{
  "schema_version": "1.0",
  "dataset": "MCNS",
  "release": "male-cns:v1.0",
  "source_page": "https://janelia-flyem.github.io/male-cns/download/",
  "license": "CC-BY-4.0",
  "notes": "Checksum oficial não publicado; SHA-256 local registrado (D09).",
  "files": [
    {
      "path": "data/raw/spikes/mcns_body_annotations.feather",
      "url": "https://storage.googleapis.com/flyem-male-cns/v1.0/connectome-data/flat-connectome/body-annotations-male-cns-v1.0-minconf-0.5.feather",
      "bytes": 14483314,
      "sha256": "2177e246113e4cfbf1e7772ec37c6da1955ff22e8063d0b1f833101f99a9a3b2",
      "md5_official": "50a7718770c57220f160ba4f431ab89e",
      "accessed_at": "2026-09-14"
    }
  ]
}
