{
  "schema_version": "1.0",
  "dataset": "BANC",
  "release": "v888",
  "source_page": "10.7910/DVN/7WTH1N",
  "license": "CC-BY-4.0-restricted",
  "notes": "277 de 379 arquivos restritos exigem pedido; este arquivo é liberado e o MD5 veio do Dataverse.",
  "files": [
    {
      "path": "data/raw/spikes/banc_888_meta.feather",
      "url": "https://dataverse.harvard.edu/api/access/datafile/14033740",
      "bytes": 57550610,
      "sha256": "819bbcff476e52702d6f8d8604ce1f12d1d7b11942281df2f49df2a73a6f15a5",
      "md5_official": "6275eda42f98c49539d1ab513d979d09",
      "accessed_at": "2026-09-14"
    }
  ]
}
