{
  "schema_version": "1.0",
  "dataset": "FlyWire/FAFB",
  "release": "v783",
  "source_page": "10.5281/zenodo.10676866",
  "license": "CC-BY-4.0",
  "notes": "Grafo CC BY 4.0; anotações do repositório sem licença declarada (CAND-01/D02).",
  "files": [
    {
      "path": "data/raw/spikes/flywire_proofread_root_ids_783.npy",
      "url": "https://zenodo.org/api/records/10676866/files/proofread_root_ids_783.npy/content",
      "bytes": 1114168,
      "sha256": "7c7b7e818e9232e5ab64793d52ba20574dbe9da3a6509fbc74193b0f259a01be",
      "md5_official": "e0e6c19732fd8c7a4e39a2d170105421",
      "accessed_at": "2026-09-14"
    },
    {
      "path": "data/raw/spikes/flywire_neuropil_pre_783.feather",
      "url": "https://zenodo.org/api/records/10676866/files/per_neuron_neuropil_count_pre_783.feather/content",
      "bytes": 16853770,
      "sha256": "35442a46f076892dff91bd6e55fa1489b3acc64fda1d35cee7dbbbbc509a3dff",
      "md5_official": "90fcdb42c1ba05ed92820840fa1e6ba0",
      "accessed_at": "2026-09-14"
    }
  ]
}
